{"$schema":"https://json-schema.org/draft/2020-12/schema","$id":"https://codestra.example/contracts/orbit-adoption-manifest.schema.json","title":"Codestra Orbit production-platform adoption manifest","type":"object","additionalProperties":false,"required":["$schema","schemaVersion","contractId","repository","classification","targetBranch","adoptionMode","domain","domainStatus","sourceAuthority","packages","requirements","evidence","status","productionReady","runtimeActivated","blockers"],"properties":{"$schema":{"const":"./contracts/adoption-manifest.schema.json"},"schemaVersion":{"const":"2.0.0"},"contractId":{"const":"codestra-orbit-v2.0.0"},"repository":{"const":"appolon1908-hue/codestra-production-platform"},"classification":{"const":"runtime-infrastructure"},"targetBranch":{"const":"release/production-activation"},"adoptionMode":{"const":"contract-only"},"domain":{"type":"null"},"domainStatus":{"const":"not-applicable"},"sourceAuthority":{"type":"object","additionalProperties":false,"required":["repository","pullRequest","candidateHeadSha","candidateChecks","protectedReleaseSha","releaseTag","releaseManifestPath"],"properties":{"repository":{"const":"appolon1908-hue/SDK-repository"},"pullRequest":{"const":75},"candidateHeadSha":{"type":"string","pattern":"^[0-9a-f]{40}$"},"candidateChecks":{"type":"array","minItems":5,"maxItems":5,"items":{"type":"object","additionalProperties":false,"required":["name","runId","status"],"properties":{"name":{"type":"string","minLength":1},"runId":{"type":"integer","minimum":1},"status":{"const":"PASS"}}}},"protectedReleaseSha":{"oneOf":[{"type":"null"},{"type":"string","pattern":"^[0-9a-f]{40}$"}]},"releaseTag":{"oneOf":[{"type":"null"},{"type":"string","minLength":1,"maxLength":128}]},"releaseManifestPath":{"const":"orbit/release/orbit-v2.0.0.json"}}},"packages":{"type":"array","minItems":9,"maxItems":9,"items":{"type":"object","additionalProperties":false,"required":["name","version","sha256","installAllowed"],"properties":{"name":{"type":"string","pattern":"^@corporate/[a-z0-9-]+$"},"version":{"const":"2.0.0"},"sha256":{"oneOf":[{"type":"null"},{"type":"string","pattern":"^[0-9a-f]{64}$"}]},"installAllowed":{"type":"boolean"}}}},"requirements":{"type":"object","additionalProperties":false,"required":["noCompetingUiSource","adoptionLedger","domainRegistry","identityEvidence","immutableArtifacts","edgeSourceLocks","stagingEvidence","accessibilityEvidence","authSessionEvidence","observability","rollback","separateProductionApproval"],"properties":{"noCompetingUiSource":{"const":true},"adoptionLedger":{"const":true},"domainRegistry":{"const":true},"identityEvidence":{"const":true},"immutableArtifacts":{"const":true},"edgeSourceLocks":{"const":true},"stagingEvidence":{"const":true},"accessibilityEvidence":{"const":true},"authSessionEvidence":{"const":true},"observability":{"const":true},"rollback":{"const":true},"separateProductionApproval":{"const":true}}},"evidence":{"type":"object","additionalProperties":false,"required":["consumerAdoptionLedger","runtimeActivationGates","domainRegistry","identityClientRegistry","immutableApplicationArtifacts","edgeSourceLocks","stagingScreenshots","accessibilityReport","authSessionReport","observabilityReport","rollbackRehearsal","productionReadback"],"properties":{"consumerAdoptionLedger":{"const":"orbit/adoption-ledger.json"},"runtimeActivationGates":{"const":"orbit/runtime-activation-gates.json"},"domainRegistry":{"oneOf":[{"type":"null"},{"type":"string","minLength":1,"maxLength":512}]},"identityClientRegistry":{"oneOf":[{"type":"null"},{"type":"string","minLength":1,"maxLength":512}]},"immutableApplicationArtifacts":{"oneOf":[{"type":"null"},{"type":"string","minLength":1,"maxLength":512}]},"edgeSourceLocks":{"oneOf":[{"type":"null"},{"type":"string","minLength":1,"maxLength":512}]},"stagingScreenshots":{"oneOf":[{"type":"null"},{"type":"string","minLength":1,"maxLength":512}]},"accessibilityReport":{"oneOf":[{"type":"null"},{"type":"string","minLength":1,"maxLength":512}]},"authSessionReport":{"oneOf":[{"type":"null"},{"type":"string","minLength":1,"maxLength":512}]},"observabilityReport":{"oneOf":[{"type":"null"},{"type":"string","minLength":1,"maxLength":512}]},"rollbackRehearsal":{"oneOf":[{"type":"null"},{"type":"string","minLength":1,"maxLength":512}]},"productionReadback":{"oneOf":[{"type":"null"},{"type":"string","minLength":1,"maxLength":512}]} }},"status":{"enum":["PREPARED_PENDING_SDK_PROTECTED_RELEASE","SDK_RELEASE_PINNED","CONSUMER_ADOPTION_IN_PROGRESS","STAGING_CERTIFIED","PRODUCTION_APPROVAL_PENDING","PRODUCTION_CERTIFIED","ROLLED_BACK","BLOCKED"]},"productionReady":{"type":"boolean"},"runtimeActivated":{"type":"boolean"},"blockers":{"type":"array","items":{"type":"object","additionalProperties":false,"required":["code","description"],"properties":{"code":{"type":"string","pattern":"^[A-Z0-9_]+$"},"description":{"type":"string","minLength":1,"maxLength":240}}}}}}
